{
  "artifact_policy": "metadata_only_values_omitted",
  "baseline_backend_sequences": [
    "reference-cpu->reference-cpu",
    "reference-cpu->reference-cpu->reference-cpu->reference-cpu"
  ],
  "blocked_execution_surfaces": [
    "backend_plugin_discovery",
    "device_access",
    "dynamic_import",
    "dynamic_library_loading",
    "generated_artifact_execution",
    "jit_execution",
    "network_access",
    "subprocess_execution"
  ],
  "candidate_backend_sequences": [
    "linear-sim->vector-sim",
    "vector-sim->vector-sim",
    "linear-sim->vector-sim->vector-sim->vector-sim"
  ],
  "case_count": 10,
  "cases": [
    {
      "baseline_backend_sequence": [
        "reference-cpu",
        "reference-cpu"
      ],
      "baseline_reference_correctness_digest": "sha256:a8f0678065842d149f2c819e36d92b4b7baa9064b2c76faefe489f75c96dfec6",
      "baseline_run_id": "reference_cpu",
      "baseline_trace_step_count": 2,
      "candidate_backend_sequence": [
        "linear-sim",
        "vector-sim"
      ],
      "candidate_reference_correctness_digest": "sha256:a8f0678065842d149f2c819e36d92b4b7baa9064b2c76faefe489f75c96dfec6",
      "candidate_run_id": "capability_selected_simulators",
      "candidate_trace_step_count": 2,
      "case_id": "research_module_matmul_elementwise",
      "comparison_count": 1,
      "comparison_metadata_digest": "sha256:342657e13059f353106f3451462ec2f37ee1880330ce691cf3dcb03c744fc452",
      "declared_tensor_shapes": {
        "a": [
          4,
          8
        ],
        "b": [
          8,
          2
        ],
        "y": [
          4,
          2
        ]
      },
      "equivalence_report_digest": "sha256:f28ddccf6afe497c0b3b54423bb9fac664ba75e491b4134c63fed8982eea06e1",
      "graph_name": "research_matmul_elementwise",
      "kernel_name": "matmul_elementwise",
      "operation_families": [
        "elementwise",
        "matmul"
      ],
      "passed": true,
      "profile_case_id": "research_module_matmul_elementwise:base",
      "profile_id": "base",
      "raw_value_policy": "omitted_by_policy",
      "run_count": 2,
      "status": "backend_equivalence_shape_profile_bound",
      "tensor_shape_digest": "sha256:9481dfef83604e6d857aa2a87c7535f60ab65fd4482d15f8096d00207c7b0caa",
      "terminal_outputs": [
        "activated"
      ]
    },
    {
      "baseline_backend_sequence": [
        "reference-cpu",
        "reference-cpu"
      ],
      "baseline_reference_correctness_digest": "sha256:5a45dd824f674fcfec2ed99fe51fc1bfe413d1a31e94f009b93255bd825803bd",
      "baseline_run_id": "reference_cpu",
      "baseline_trace_step_count": 2,
      "candidate_backend_sequence": [
        "linear-sim",
        "vector-sim"
      ],
      "candidate_reference_correctness_digest": "sha256:5a45dd824f674fcfec2ed99fe51fc1bfe413d1a31e94f009b93255bd825803bd",
      "candidate_run_id": "capability_selected_simulators",
      "candidate_trace_step_count": 2,
      "case_id": "research_module_matmul_elementwise",
      "comparison_count": 1,
      "comparison_metadata_digest": "sha256:a634b980c79ecacc014db145456e025819f9a693720f1852b3eaa5c6716bf7e9",
      "declared_tensor_shapes": {
        "a": [
          3,
          5
        ],
        "b": [
          5,
          4
        ],
        "y": [
          3,
          4
        ]
      },
      "equivalence_report_digest": "sha256:9606336deb96271a9e08915719f1bcb723bfaddc1414810bf8c443407237f3f5",
      "graph_name": "research_matmul_elementwise",
      "kernel_name": "matmul_elementwise",
      "operation_families": [
        "elementwise",
        "matmul"
      ],
      "passed": true,
      "profile_case_id": "research_module_matmul_elementwise:alternate",
      "profile_id": "alternate",
      "raw_value_policy": "omitted_by_policy",
      "run_count": 2,
      "status": "backend_equivalence_shape_profile_bound",
      "tensor_shape_digest": "sha256:8f2cdc03364754238e645997d14af3407bf380ce00900265aac331621662bab7",
      "terminal_outputs": [
        "activated"
      ]
    },
    {
      "baseline_backend_sequence": [
        "reference-cpu",
        "reference-cpu"
      ],
      "baseline_reference_correctness_digest": "sha256:b7822b1cff26e2926b9b4f726f7c734ac468325557a3067e5d8112dc530a2f51",
      "baseline_run_id": "reference_cpu",
      "baseline_trace_step_count": 2,
      "candidate_backend_sequence": [
        "vector-sim",
        "vector-sim"
      ],
      "candidate_reference_correctness_digest": "sha256:b7822b1cff26e2926b9b4f726f7c734ac468325557a3067e5d8112dc530a2f51",
      "candidate_run_id": "capability_selected_simulators",
      "candidate_trace_step_count": 2,
      "case_id": "research_module_softmax_reduction",
      "comparison_count": 1,
      "comparison_metadata_digest": "sha256:e8ba1ed129150f8548fcb3da9988103d47cc4ce298080434cd7c22d9da2b86a7",
      "declared_tensor_shapes": {
        "x": [
          4,
          8
        ],
        "y": [
          4
        ]
      },
      "equivalence_report_digest": "sha256:6060ea86aed431c4808a356ec424a18a260a39d1e0fb4b410ff7ed0fd201135f",
      "graph_name": "research_softmax_reduction",
      "kernel_name": "softmax_reduction",
      "operation_families": [
        "reduction",
        "softmax"
      ],
      "passed": true,
      "profile_case_id": "research_module_softmax_reduction:base",
      "profile_id": "base",
      "raw_value_policy": "omitted_by_policy",
      "run_count": 2,
      "status": "backend_equivalence_shape_profile_bound",
      "tensor_shape_digest": "sha256:2616ed8b1a6608333d7c6f82db2a7666a1ef17979976d65bbbe1cc9c120e763f",
      "terminal_outputs": [
        "row_sum"
      ]
    },
    {
      "baseline_backend_sequence": [
        "reference-cpu",
        "reference-cpu"
      ],
      "baseline_reference_correctness_digest": "sha256:d2fc317731d87672edd6d3894791f7b1627867d061cb803e834a4d8c67f907e5",
      "baseline_run_id": "reference_cpu",
      "baseline_trace_step_count": 2,
      "candidate_backend_sequence": [
        "vector-sim",
        "vector-sim"
      ],
      "candidate_reference_correctness_digest": "sha256:d2fc317731d87672edd6d3894791f7b1627867d061cb803e834a4d8c67f907e5",
      "candidate_run_id": "capability_selected_simulators",
      "candidate_trace_step_count": 2,
      "case_id": "research_module_softmax_reduction",
      "comparison_count": 1,
      "comparison_metadata_digest": "sha256:bf241ea1b95ded7530d2c2ea41aa77b5dee43e7ce186f01e30bb734efcb4ee6f",
      "declared_tensor_shapes": {
        "x": [
          3,
          5
        ],
        "y": [
          3
        ]
      },
      "equivalence_report_digest": "sha256:a8ca4c88977414ef45e2f5ca50b7fb8a29e006bf05f600ed6581f1acb806172e",
      "graph_name": "research_softmax_reduction",
      "kernel_name": "softmax_reduction",
      "operation_families": [
        "reduction",
        "softmax"
      ],
      "passed": true,
      "profile_case_id": "research_module_softmax_reduction:alternate",
      "profile_id": "alternate",
      "raw_value_policy": "omitted_by_policy",
      "run_count": 2,
      "status": "backend_equivalence_shape_profile_bound",
      "tensor_shape_digest": "sha256:15e120111c9311dc7212dc002ac0e058becbaece364e2b8661540666bc9930a2",
      "terminal_outputs": [
        "row_sum"
      ]
    },
    {
      "baseline_backend_sequence": [
        "reference-cpu",
        "reference-cpu"
      ],
      "baseline_reference_correctness_digest": "sha256:9514eab74294966fa28f71a4b38fe054454676208a92961518272a34b21ab9ef",
      "baseline_run_id": "reference_cpu",
      "baseline_trace_step_count": 2,
      "candidate_backend_sequence": [
        "linear-sim",
        "vector-sim"
      ],
      "candidate_reference_correctness_digest": "sha256:9514eab74294966fa28f71a4b38fe054454676208a92961518272a34b21ab9ef",
      "candidate_run_id": "capability_selected_simulators",
      "candidate_trace_step_count": 2,
      "case_id": "research_module_matmul_reduction",
      "comparison_count": 1,
      "comparison_metadata_digest": "sha256:adb72fed1e0c092dcea07da0429ea558acaafedaba7a3dfccf08c272bb3681e6",
      "declared_tensor_shapes": {
        "a": [
          4,
          8
        ],
        "b": [
          8,
          2
        ],
        "y": [
          4
        ]
      },
      "equivalence_report_digest": "sha256:be9e635b78d89a3f998ad56cddf1476ddad2e7ed18ccfe06c378cd9d934b4911",
      "graph_name": "research_matmul_reduction",
      "kernel_name": "matmul_reduction",
      "operation_families": [
        "matmul",
        "reduction"
      ],
      "passed": true,
      "profile_case_id": "research_module_matmul_reduction:base",
      "profile_id": "base",
      "raw_value_policy": "omitted_by_policy",
      "run_count": 2,
      "status": "backend_equivalence_shape_profile_bound",
      "tensor_shape_digest": "sha256:e46ba19ae3c6d3edb5c6ea94515f018075a7bc7aec2ab8db6f873b80b660b946",
      "terminal_outputs": [
        "column_sum"
      ]
    },
    {
      "baseline_backend_sequence": [
        "reference-cpu",
        "reference-cpu"
      ],
      "baseline_reference_correctness_digest": "sha256:c6eaa9e141ab8d5d6cedfdf2f33e53d653f956fb282cc62d128448ea57f13de1",
      "baseline_run_id": "reference_cpu",
      "baseline_trace_step_count": 2,
      "candidate_backend_sequence": [
        "linear-sim",
        "vector-sim"
      ],
      "candidate_reference_correctness_digest": "sha256:c6eaa9e141ab8d5d6cedfdf2f33e53d653f956fb282cc62d128448ea57f13de1",
      "candidate_run_id": "capability_selected_simulators",
      "candidate_trace_step_count": 2,
      "case_id": "research_module_matmul_reduction",
      "comparison_count": 1,
      "comparison_metadata_digest": "sha256:8c4e2b3d2271c4a30acd3655e8e723d8026709a8cd5c8d4807eb8f946c5a6d64",
      "declared_tensor_shapes": {
        "a": [
          3,
          5
        ],
        "b": [
          5,
          4
        ],
        "y": [
          3
        ]
      },